ID Paper;Title;Abstract
69876;Traditional and new ways in competence management: Application of HR analytics in competence management;This article within the magazine Gruppe. Interaktion. Organisation. (GIO) provides an overview of established and new ways in competence management, with a¬†focus on the HR Analytics approach. Competence management has come a¬†long way. Since the beginning of competence research in the 1970‚Äôs technological progress and altering competence demands among employees have drastically reshaped the landscape of employment. Handling complexity and large amounts of information has become essential in order to keep up with developments of today‚Äôs world. The globalised competition has fostered an increasingly intense ‚ÄòWar for Talents‚Äô  under volatile circumstances. How can an organisation develop an anticipative competence strategy if there are so many variables regarding the future? Since digitalization and the evolving field of big data and predictive analytics enable new ways of information processing, new concepts for human resources management are required. The most prominent approach nowadays is a¬†company-specific competence model that is derived from the organisational strategy. Employees are developed with regard to the competence strategy‚Äîeven though it might turn out as too rigid to react flexibly to changing environmental conditions in a¬†steadily faster global competition. We state that this process can be extended by a¬†data-driven approach in order to support HR departments and achieve an improved rate of correct assessments for future HR developmental measures.
98748;An ontology-based approach to aid the application of competency-oriented curriculum principles in open educational resources;Competency-based education has attracted the attention of the technology-enriched learning community but presents challenges in translating competency-oriented curriculum principles into concrete learning materials. This project aims to provide a framework to support the annotation of open educational resources based on competency ontology and mitigate that challenge. ¬© 2022 Copyright for this paper by its authors.
98756;Knowledge engineering for competence assessment on serious games based on semantic web;Recognizing the inadequacy of traditional knowledge-based assessment systems in higher education to discover Learner competencies, we rethink the design of traditional assessment, using approaches that can both respond to the corporate requirements of the twenty-first century and reflect learners' competencies. The serious game sector has gained prominence in the last decade and the need to assess players' competencies in terms of knowledge, skills, and attitudes has grown. The assessment typically involves analyzing the player's performance in the game environment. At the same time, ontologies have emerged as one of the most popular and widely accepted tools in technology-enhanced learning and assessment. This paper proposes a framework for Competence Assessment based on ontological models for the generation of Personalized Assessment Scenarios, Assessment Portfolios and Personalized Assessment Paths on Serious games. Assessment Portfolios are used to track and store learners' interactions with the games, which can then be used as proof of competence during the assessment process. The personalized assessment scenarios on serious games are formalized with First Order Logic rules that are able to reason over resources annotated with Semantic Web metadata, thus allowing the reusability and interoperability of data. ¬© 2019 IEEE.
98805;Competency based approach: Modeling and implementation;The expansion of computer networks has at the same time given impetus to the distance learning environments. E-learning systems are also advanced and more efficient. However, these platforms offer such complex teaching functionalities that designers find themselves poorly equipped to succeed in their engineering processes. This article presents a tool that makes it easier for designers to produce educational content according to the Competency-Based Approach (CBA). We propose an implementation of the CBA after its modeling via ontology. Our module can be grafted to any author system oriented pedagogy based skills. We have advocated for Service Oriented Architecture as a software solution to model our business process that consists of a set of interconnected services that are modeled and implemented. The proposed system is the result of a coordination of, services, incorporating the order of competences explained by a distance education, which integrates and interacts according to an orchestration plan. ¬© Kassel University Press GmbH.
98807;A Knowledge-Model for AI-Driven Tutoring Systems;A powerful new complement to traditional synchronous teaching is emerging: intelligent tutoring systems. The narrative: A learner interacts with a digital agent. The agent reviews, selects and proposes individually tailored educational resources and processes - i.e. a meaningful succession of instructions, tests or groupwork. The aim is to make personal tutored learning the new norm in higher education - especially in groups with heterogeneous educational backgrounds. The challenge: Today, there are no suitable data that allow computer-agents to learn how to take reasonable decisions. Available educational resources cannot be addressed by a computer logic because up to now they have not been tagged with machine-readable information at all or these have not been provided uniformly. And what's worse: there are no agreed conceptual and structured models of what we understand by 'learning', how this model-to-be could be implemented in a computer algorithm and what those explicit decisions are that a tutoring system could take. So, a prerequisite for any future digital agent is to have a structured, computer-accessible model of 'knowledge'. This model is required to qualify and quantify individual learning, to allow the association of resources as learning objects and to provide a base to operationalize learning for AI-based agents. We will suggest a conceptual model of 'knowledge' based on a variant of Bloom's taxonomy, transfer this concept of cognitive learning objectives into an ontology and describe an implementation into a web-based database application. The approach has been employed to model the basics of abstract knowledge in engineering mechanics at university-level. This paper addresses interdisciplinary aspects ranging from a teaching methodology, the taxonomy of knowledge in cognitive science, over a database-application for ontologies to an implementation of this model in a Grails service. We aim to deliver this web-based ontology, its user-interfaces and APIs into a research network that qualifies AI-based agents for competence-based tutoring.  ¬© 2021 The authors and IOS Press.
98823;Ontology for continuous learning and support;Acquiring new knowledge and skills is the principal goal of any educational institution. Universities planned always to improve the learning methods to offer high academic competencies qualities for students. These competencies help students to respond to the needs of companies‚Äô missions during their internships. In some cases, some companies‚Äô missions required more competencies in a special domain activity. Therefore, we proposed our method based on a continuous learning ontology where a student can do his job with the support and assistance of a specific service or from his supervisor. This ontology will permit to take into consideration, in addition to competencies, the abilities of students to ensure interoperability between company and university by ensuring matching between the actual student skills and required mission skills. Thus, the proposed approach will establish an efficiency matching between the company needs and the students. Results show the benefits of such an approach to resolving the gap between industry needs and students‚Äô skills. ¬© Springer Nature Switzerland AG 2019.
98824;Ontology of the CBA: Towards Operationalization and Implementation;"To remedy inefficiency and increase the quality of learning, training systems have adopted a pedagogical approach based on competence bases. It is a concept that is common to the academic and professional communities; which imposes the use of ontology of the CBA to conceptualize a dynamic repository, determining the terminological semantics of skills, which is sectorial with pedagogical norms. We propose a CBA ontology that focuses on explicit modeling of competency in order to provide a shared formal representation that promotes exchange, interoperability and collaboration among the various users in the learning systems. Our goal is not just to build an appropriate ontology. Our ambition is to implement this solution in an authoring system to assist tutors with didactic intentions based on skills to produce CBA based educational content. ¬© 2018, Springer International Publishing AG."
98841;From content management to E-learning content repositories;The concept of content in an educational context is very different from the one in other fields such as publishing or electronic newspapers, for example. From textbooks to exercises, from software simulations to data sets containing educational data, it is necessary to rethink the way these educational resources or learning objects are managed. One of the major concerns for teachers using e-learning environments is the availability of the appropriate structures and tools for organizing such learning resources and making them accessible to learners. This is especially true for e-learning virtual environments where learners have access to both digital libraries and also to any other Web resource, through Google or other conventional search engines. Nevertheless, these systems are usually not directly integrated in the learning process and content and metadata management requires the use of different tools. Furthermore, new pedagogical approaches consider the learner as an active element in the learning process, promoting the acquisition and development of competences through activities which involve the use and creation of learning resources. This chapter explores the relationship of traditional content management systems and the broader scope of virtual learning environments, including aspects of metadata standards, content personalization, the use of semantic web techniques and ontologies, the use and annotation of learning resources and the possibilities offered by the use of Web 2.0 technologies. At the end of this chapter, the possible learning scenarios that will be derived from all the changing forces, combining methodological, technological and organizational issues will be described. ¬© 2011 Springer Science+Business Media, LLC.
98878;Bridging the gap between competency based approach and intelligent tutoring systems;The Competency Based Approach (CBA) represents a real opportunity for the development of higher education in Morocco, combined with the advantages of Intelligent Tutoring Systems (ITS), this approach could well solve many problems, particularly the inadequacy between school teaching and labor market needs, the professional achievements enhancing, overcrowded classrooms, etc. Convinced by the undeniable contribution of technology to all teaching methods and based on our experience of CBA adoption, we propose an ontology and a conceptual technological architecture to allow the CBA to take benefit from the technological advances of ITS. To justify the interest of designing a new ITS architecture supporting the CBA, we will highlight the changes resulting from CBA adoption, in understanding, reasoning and competency modeling, also in learner modeling, learner pathway management and pedagogical engineering. ¬© Research India Publications.
98907;Interoperability framework for competences and learning outcomes;This research work was carried out in the areas of Higher Education, Teaching Technology and Web Information Management with the aim of developing a model for identifying and classifying competences and learning outcomes (MICRA) and an ontology of the information management model (SICRA). The MICRA model was applied in a case study, whereas the verification and validation of its previously defined functionalities led to ontology validation. MICRA shows to be an innovative model, based on a thorough, organized and systematic analysis of the educational context. In addition, SICRA goes beyond other ontologies as it not only defines reusable competences, classified according to Bloom¬¥s taxonomy, but also defines and establishes a correspondence among Computer Science Knowledge Areas. We have thus contributed to making learning institutions‚Äô training curricula widely available, allowing for their contrastive analysis in order to promote student and teacher mobility within the European Higher Education Area and in other countries. ¬© J.UCS.
98908;Knowledge-based model for curricular design in Ecuadorian universities;The contemporary generation of students needs to acquire competences that help them to exercise judgment and solve problems aiming to face current economic and technological challenges. On the basis of this understanding, competence-based education with its teaching and learning approaches has received a good deal of attention and support in recent years. In this sense, the correct design of curriculums represents one of the main means for the gradual and systematic formation of these competences. Despite this fact, in Ecuador there is not a knowledge management model for competence-based curricular design at university education level. Hence, in this work, we propose a knowledge-based model for the design of competencebased curriculums that allow professionals to use teaching and learning strategies that facilitate the development and demonstration of competence, thus contributing to the academic formation of high-level professionals in Ecuadorian universities. All aforementioned will be possible thanks to the implementation of a Cloud-based platform that combines current technologies such as social networks, data mining, and ontologies in order to provide Ecuadorian professionals with the means for the design of competence-based curriculums. ¬© Springer International Publishing AG 2016.
98910;An ontology-based learning system in IT project management;"This chapter presents a Web-based learning system in IT project management, capable of building and conducting a complete and personalized training cycle, from the definition of the learning objectives to the assessment of the learning results for each learner. The focus is on the content management solution, using an educational ontology and a competency catalogue, both of them developed by the author in line with the ICB 3.0 competency standard. Ontology-based learning is considered in the context of competency-based learning. The competency catalogue allows the identification of a possible gap between the reference and the actual competency profiles and the identification of the training requirements. An ontology-based project management learning approach allows one to find the most suitable educational programmes and training when there is a similarity but not an exact match between education and training offers and the competency gap. The development process is based on the state of the art IT technologies (metadata and ontology for knowledge manipulation, Web services, learner model, and intelligent tutoring systems). Besides interoperability and personalization, the proposed approach brings additional advantages, including: unitary interpretation of the content structure by different user categories or content providers; explicit specification of the knowledge domain, allowing the updating of the domain definition without major changes of e-learning tools and programmes; reuse of the learning objects with economical advantages by saving costs of (re)writing the content for the different course forms and strategies; reuse of the created tools in one domain in other domains; promoting the competency-based learning through the domain ontology and the relations between concepts and competencies. The results obtained in practice are very encouraging and suggest several future developments. ¬© 2011, IGI Global."
98922;Integration of competencies in an ontology-based framework supporting teachers to construct learning designs in the domain of sustainable energy education;In previous work, a framework based on three ontologies (content, learning design and sustainable energy domain models) was introduced in order to support teachers to con-struct learning designs in the field of sustainable energy education. This paper is focusing on the integration of a competency model in the structure of this framework. This model actually interconnects the other three models by establishing connections between learning objects, learners, activities, learning objectives/competencies and knowledge in the sus-tainable energy domain. It enriches the description of learning resources enabling their search and retrieval via queries based on competency parameters and can also support competency-based reasoning in order for the competency gaps to be filled. The competency model came as an answer to a literature review triggered by some results of a Wizard of Oz experiment along with the aim to integrate into the framework sets of questions supporting learning in sustainable energy domain.
98954;Enhancing ontology-based educational content search service with competency;In this paper we present a methodology for designing competency based web search framework using ontology to acquire the learning contents that meets the individuals' competency. We used ontology with OWL-DL to built competency ontology, content ontology and domain ontology to implement competency based contents search system. The basic ontology-based search system, however, lacks the method of ranking the search results. To present more appropriate learning contents for the learner, we applied competency clustering to rank the search results. ¬© 2008 IEEE.
98968;An ontology and a software framework for competency modeling and management;The importance given to competency management is well justified. Acquiring new competencies is the central goal of any education or knowledge management process. Thus, it must be embedded in any software framework as an instructional engineering tool, to inform the runtime environment of the knowledge that is processed by actors, and their situation toward achieving competency-acquisition objectives. We present here some of our results in the last 10 years that have led to an ontology for designing competency-based learning and knowledge management applications. Based on this ontology, we present a software framework for ontology-driven e-learning systems. ¬© International Forum of Educational Technology & Society (IFETS).
98969;Affordances of machine-processable competency modelling;"Existing e-learning competency standards such as the IMS Reusable Definition of Competency or Educational Objective (IMS RDCEO) specification and the HR-XML standard are not able to accommodate the level of a competency described separately from its narrative description; the grading scale of a competency; the success threshold of a competency; or the structure of competency trees or hierarchies. The proposed competency model addresses these problems and reflects all relevant features of the learner's behaviour and their knowledge, skills, and attitudes that affect their learning and performance. Statements of competency are machine-readable. Machine processing can offer interoperable and reusable resources and applications that are pedagogically effective for e-learning and assessment. A competency statement which can be read, processed, and interpreted by machine contributes to the automatic generation of questions, distractors, and question sequences, and offers a semantic structure for further processing."
99039;The model of continuous profession-oriented learning in the e-environment based on a competence approach and academic knowledge management;The paper presents a model of continuous profession-oriented learning in the electronic environment at organizational, technological and learning levels. The learning level involves the application of modern technologies in e-pedagogies. The educational process is being built on the bases of iterative analysis, competence assessment and individual trajectories of learning. The organizational level implies the formation of integrated knowledge space which unites community of teachers from various higher educational institutions, research organizations and business enterprises within the system of academic knowledge management. At the technological level the members and partners of the integrated knowledge space are provided with appropriate instruments within the framework of social networks to develop educational and methodological materials, tosearch, to capture, to accumulate and to systematize knowledge with respect to the competence model'srequirements based on ontology method. The model aims at developing the methodology for creating and maintaining the intelligence systems to generate comprehensive competences. It enables the educationinstitutions to effectively solve the problem of enhancing the education quality and assurance to meet the requirements of the business innovative development in knowledge society.
99052;An ontology for describing competency-based curriculum at engineering careers;Nowadays universities need to define the curriculums and subjects of their careers using the concept of professional competencies. This implies properly identifying the knowledge, skills and aptitudes that a professional need to practise, and with it, the curricular activities that will allow him to achieve it. The definition of based-competency curriculums it is a new paradigm that requires changes in the way of teaching. In this work the authors propose an ontology that conceptualizes the idea of competencies in the formulation of the curriculum of subjects, focused on university engineering careers. This ontology is part of an ontology network developed previously by the authors. The idea is to take a step forward in the definition of e-learning semantic tools that give support to teacher in the formulation of the competencies and the selection of teaching material and assessment tools, establishing relationships between all of them to achieve the objectives. In this way, this work provides a conceptual framework that facilitates the definition of competency-based curriculums and allows relating it with the teaching and assessment methodologies to achieve the defined competencies. ¬© 2019 AISTI.
99102;Towards a semantic framework for lifelong integrated competency management and development;In the domain of technology-enhanced competency-based learning and training, there is an increased interest in the integration of competency-related information for supporting competency-driven decision-making purposes. Indeed, since competency development draws upon several related areas, including teaching subjects, instructional design, learning resource annotation, e-Portfolios and motivated by the need for an integrated and semantic-based approach to competency management and development, a series of ontological structures have been formalized and developed for each of these areas. This paper aims to provide a framework specification for lifelong competency management and development, called LCMDF. The main advantage of this framework lies in its ability to provide a unifying semantic foundation in the form of a set of controlled vocabularies for describing competencies and their related details within the contexts of technology-enhanced competency-based learning and training. Moreover, this framework provides a novel integrated model to support a wide range of use cases. The proposed framework results from reusing widespread international standards for competency modeling which helps designing and implementing interoperability architecture of semantically-enhanced competency-based learning/human resource (HR) systems. ¬© The British Computer Society 2019. All rights reserved.
99161;An ontology-based multi-level semantic representation model for learning objects annotation;In technology-enhanced learning, semantic annotations have been employed to attach semantic metadata to learning materials in order to significantly enhance their accessibility by human users and machines as well. In this paper, we present an ontology-based multi-level semantic representation model that aims to enrich the description of learning objects with semantics regarding their subjects, competencies and instructional roles. More specifically, the proposed model uses three ontologies: a subject domain ontology describing the domain concepts and the relations that are covered by the subject matter being taught, a competency ontology describing the competency-related characteristics of learners and learning resources, and an instructional role ontology specifying the instructional role(s) a learning object can play in an instructional setting. To demonstrate the feasibility of our model, an illustrative example is given that explains how learning object semantics can be represented with different granularities. ¬© 2017 IEEE.
