ID Paper;Title;Abstract
99195;Modeling competencies in competency-based learning: classification and cartography;Despite the importance of competency modeling for both individuals and organizations, there is a lack of a comprehensive literature review and a cartography for it. This paper aims to provide an in-depth overview of different approaches to competency modeling reported in the field of technology-enhanced com petency-based learning. This literature review is complemented by an additional overview of related initiatives toward modeling intended learning outcomes, learning opportunities, achieved learning outcome profiles of learners and competency maps. In addition, a cartography illustrating the relationships between some important models is proposed. The main purpose of this work is to provide researchers with a comprehensive review of the current status in this field as well as to highlight ongoing issues and challenges that need to be addressed. ¬© 2018 IEEE.
99199;Design of a learner model based on the competency-based approach ontology;Intelligent Tutoring Systems (ITS) have been subject of an effort of standardization in different aspects. Among these are the actors of the learning process. We are particularly interested in modeling the learner in order to better adapt their learning to today‚Äôs ITS. A number of architectures of the learner model (LM) have been proposed from different points of view. However, few works have integrated the aspect of competency. In this work, we propose a learner model based on the ontology of the competency-based approach (CBA) comprising two main specifications, a learner-competency centered model and a dynamic model that adapts to different learning contexts. ¬© Research India Publications.
188097;Objetos de Aprendizaje basados en Competencias: Una metodologÌa para su desarrollo en carreras de IngenierÌa;"Actualmente, las carreras de IngenierÌa se encuentran inmersas en un proceso de cambio de paradigma hacia la enseÒanza que adopte el Enfoque por Competencias (EC). Esto presenta un nuevo desafÌo para el desarrollo asertivo de materiales como actividad complementaria a la planificaciÛn de la secuencia did·ctica que realiza el docente para plantear un recorrido de aprendizaje que contemple actividades reales o simuladas propias del contexto profesional futuro. En este trabajo los autores proponen una metodologÌa para la creaciÛn de objetos de aprendizaje (OA) en entornos formativos basado en el EC en carreras de IngenierÌa. Esta metodologÌa incluye la definiciÛn de actores, roles, actividades, insumos y entregables correspondientes a cada fase; considerando tanto la perspectiva tÈcnica como la pedagÛgica de este proceso. La metodologÌa planteada ha sido empleada para un caso de estudio, donde a partir de un software para programar MÈtodos NumÈricos (MN) se genera un OA que se pretende ingresar a un Repositorio Institucional de Acceso Abierto (RIAA). La propuesta metodolÛgica facilita la generaciÛn de OA de calidad, con las caracterÌsticas necesarias para su adopciÛn exitosa por parte de los alumnos y docentes, y para su reutilizaciÛn en diferentes contextos educativos virtualizados."
223570;Competency-Based Personalization Process for Smart Learning Environments;This chapter is a synthesis on the role of competency models in smart learning environments. A formal definition of competency, integrating the notions of skill/attitudes, knowledge, and performance, provides a foundation for the discussion. Concrete examples and tools will illustrate the role of competencies to help personalize learning scenarios, a central goal for smart learning environments. Competency as an input to and as an outcome of the learning process will be integrated in a learning design methodology, including user models and e-portfolios. A method for comparing competency will serve in the definition of assistance agents or recommenders. Finally, a number of research challenges will be identified.
223572;An Ontological Approach to Support Design competency-based curriculum;Different methodological guidelines, lack of clarity in designing curriculum modules, as well as the diversity of definitions and conceptions presents in the competence approach are drawbacks for designers of competency-based curricula. This paper presents a system designed under an ontological approach, which aims to support the design of competency-based curricula. The system emphasizes aspects such as graduate profiles and curriculum modules. The ontology is a framework to formally describe the domain knowledge of curriculum design, ensuring a consistent and unambiguous vocabulary.
